Key,Item Type,Publication Year,Author,1,Title,Fonte,TipoDoLink,TrataSobreGUI,Publication Title,AssuntoGUI,ISBN,ISSN,DOI,Url,Abstract Note,Date,Date Added,Date Modified,Access Date,Pages,Num Pages,Issue,Volume,Number Of Volumes,Journal Abbreviation,Short Title,Series,Series Number,Series Text,Series Title,Publisher,Place,Language,Rights,Type,Archive,Archive Location,Library Catalog,Call Number,Extra,Notes,File Attachments,Link Attachments,Manual Tags,Automatic Tags,Editor,Series Editor,Translator,Contributor,Attorney Agent,Book Author,Cast Member,Commenter,Composer,Cosponsor,Counsel,Interviewer,Producer,Recipient,Reviewed Author,Scriptwriter,Words By,Guest,Number,Edition,Running Time,Scale,Medium,Artwork Size,Filing Date,Application Number,Assignee,Issuing Authority,Country,Meeting Name,Conference Name,Court,References,Reporter,Legal Status,Priority Numbers,Programming Language,Version,System,Code,Code Number,Section,Session,Committee,History,Legislative Body
US293JCW,conferencePaper,2016,"Anwar, Inzamam; Mohsin, M. Owais; Iqbal, Saqib; Abideen, Zain Ul; Rehman, Attique Ur; Ahmed, Nisar",87,Design and fabrication of an underwater remotely operated vehicle (Single thruster configuration),,,,2016 13th International Bhurban Conference on Applied Sciences and Technology (IBCAST),,,,,http://ieeexplore.ieee.org/xpls/abs_all.jsp?arnumber=7429932,,2016,2016-09-06 21:02:25,2016-09-06 21:02:25,2016-09-06 21:02:25,547–553,,,,,,,,,,,IEEE,,,,,,,Google Scholar,,,,/home/wagner/.mozilla/firefox/owkxzo1u.default/zotero/storage/2JR6KGE7/7429932.html,,,,,,,,,,,,,,,,,,,,,,,,,,,,,,,,,,,,,,,,,,,,,,,,,
6IEIUXUZ,conferencePaper,2015,"Lokesha, H.; Veena, S.; Rathod, Jayantkumar A.; others",88,Design of Speech Based Ground Control Station for Controlling the Micro Air Vehicles,,,,2015 Fifth International Conference on Advances in Computing and Communications (ICACC),,,,,http://ieeexplore.ieee.org/xpls/abs_all.jsp?arnumber=7433902,,2015,2016-09-06 21:02:25,2016-09-06 21:02:25,2016-09-06 21:02:25,451–454,,,,,,,,,,,IEEE,,,,,,,Google Scholar,,,,/home/wagner/.mozilla/firefox/owkxzo1u.default/zotero/storage/JDW2W6HW/7433902.html,,,,,,,,,,,,,,,,,,,,,,,,,,,,,,,,,,,,,,,,,,,,,,,,,
Q6VDNF5X,conferencePaper,2015,"Vivek, G. V.; Sunil, M. P.",89,Enabling IOT services using WIFI-ZigBee gateway for a home automation system,,,,2015 IEEE International Conference on Research in Computational Intelligence and Communication Networks (ICRCICN),,,,,http://ieeexplore.ieee.org/xpls/abs_all.jsp?arnumber=7434213,,2015,2016-09-06 21:02:25,2016-09-06 21:02:25,2016-09-06 21:02:25,77–80,,,,,,,,,,,IEEE,,,,,,,Google Scholar,,,,/home/wagner/.mozilla/firefox/owkxzo1u.default/zotero/storage/ZAD5NI6M/7434213.html,,,,,,,,,,,,,,,,,,,,,,,,,,,,,,,,,,,,,,,,,,,,,,,,,
P7VQNS99,journalArticle,2016,"Duvick, Jon; Standage, Daniel S.; Merchant, Nirav; Brendel, Volker P.",90,xGDBvm: A Web GUI-driven workflow for annotating eukaryotic genomes in the cloud,,,,The Plant Cell,,,,,http://www.plantcell.org/content/early/2016/03/28/tpc.15.00933.abstract,,2016,2016-09-06 21:02:25,2016-09-06 21:02:25,2016-09-06 21:02:25,tpc–00933,,,,,,xGDBvm,,,,,,,,,,,,Google Scholar,,,,/home/wagner/.mozilla/firefox/owkxzo1u.default/zotero/storage/EMWU2ZVI/Duvick et al. - 2016 - xGDBvm A Web GUI-driven workflow for annotating e.pdf; /home/wagner/.mozilla/firefox/owkxzo1u.default/zotero/storage/W7GW8X4X/tpc.15.00933.html,,,,,,,,,,,,,,,,,,,,,,,,,,,,,,,,,,,,,,,,,,,,,,,,,
RQVFD3BH,journalArticle,2015,"Eugene de, Villiers; Angus, Lock; Paolo, Geremia; Todd, Johansen",91,"ELEMENTS, A New Aerodynamics Analysis Software",,,,International Journal of Automotive Engineering,,,,,http://jlc.jst.go.jp/DN/JLC/20021778047?from=Google,,2015,2016-09-06 21:02:25,2016-09-06 21:02:25,2016-09-06 21:02:25,39–44,,2,6,,,,,,,,,,,,,,,Google Scholar,,,,/home/wagner/.mozilla/firefox/owkxzo1u.default/zotero/storage/AGXP6BT8/_article.html,,,,,,,,,,,,,,,,,,,,,,,,,,,,,,,,,,,,,,,,,,,,,,,,,
5VKKZP4X,journalArticle,2016,"Lee, Eun Young; Novotny, Johannes; Wagreich, Michael",92,BasinVis 1.0: a MATLAB®-based program for sedimentary basin subsidence analysis and visualization,,,,Computers & Geosciences,,,,,http://www.sciencedirect.com/science/article/pii/S0098300416300899,,2016,2016-09-06 21:02:25,2016-09-06 21:02:25,2016-09-06 21:02:25,119–127,,,91,,,BasinVis 1.0,,,,,,,,,,,,Google Scholar,,,,/home/wagner/.mozilla/firefox/owkxzo1u.default/zotero/storage/X6D8843T/S0098300416300899.html,,,,,,,,,,,,,,,,,,,,,,,,,,,,,,,,,,,,,,,,,,,,,,,,,
EZEPCM57,conferencePaper,2015,"Bao, D.; Zou, Zhuo; Huan, Y.; Zhai, Chuanying; Bagaian, T.; Tenhunen, Hannu; Källbäck, B.; Zheng, Lirong",93,A smart catheter system for minimally invasive brain monitoring,,,,"8th International Conference on Biomedical Electronics and Devices, BIODEVICES 2015; Lisbon; Portugal",,,,,http://www.diva-portal.org/smash/record.jsf?pid=diva2:860882,,2015,2016-09-06 21:02:25,2016-09-06 21:02:25,2016-09-06 21:02:25,198–203,,,,,,,,,,,SciTePress,,,,,,,Google Scholar,,,,/home/wagner/.mozilla/firefox/owkxzo1u.default/zotero/storage/23KXCRI7/record.html,,,,,,,,,,,,,,,,,,,,,,,,,,,,,,,,,,,,,,,,,,,,,,,,,
SJ3B5WTH,conferencePaper,2016,"Xypolitidis, Benard; Shabani, Rudin; Khandeparkar, Satej V.; Ul-Abdin, Zain; Nordstr, Tomas; others",94,Towards Architectural Design Space Exploration for Heterogeneous Manycores,,,,"2016 24th Euromicro International Conference on Parallel, Distributed, and Network-Based Processing (PDP)",,,,,http://ieeexplore.ieee.org/xpls/abs_all.jsp?arnumber=7445427,,2016,2016-09-06 21:02:25,2016-09-06 21:02:25,2016-09-06 21:02:25,805–810,,,,,,,,,,,IEEE,,,,,,,Google Scholar,,,,/home/wagner/.mozilla/firefox/owkxzo1u.default/zotero/storage/4C2ZEQ4X/Xypolitidis et al. - 2016 - Towards Architectural Design Space Exploration for.pdf; /home/wagner/.mozilla/firefox/owkxzo1u.default/zotero/storage/EPIS5FDR/7445427.html,,,,,,,,,,,,,,,,,,,,,,,,,,,,,,,,,,,,,,,,,,,,,,,,,
9RBM7P5B,conferencePaper,2016,"MASTRANGELO, CH",95,MF-CAE: A Novel Lab on a Chip Simulation Tool,,,,Mechanical Engineering and Control Systems: Proceedings of the 2015 International Conference on Mechanical Engineering and Control Systems (MECS2015),,,,,https://books.google.com.br/books?hl=pt-BR&lr=&id=HF7FCwAAQBAJ&oi=fnd&pg=PA337&dq=%22graphical+user+interface%22++configuration&ots=bh5sU4IRpr&sig=4o4200LnKFggVn-gmE_mIriZGy4,,2016,2016-09-06 21:02:25,2016-09-06 21:02:25,2016-09-06 21:02:25,337,,,,,,MF-CAE,,,,,World Scientific,,,,,,,Google Scholar,,,,/home/wagner/.mozilla/firefox/owkxzo1u.default/zotero/storage/GSV268TS/books.html,,,,,,,,,,,,,,,,,,,,,,,,,,,,,,,,,,,,,,,,,,,,,,,,,
XFU3D5M6,thesis,2015,"Ponsard, Antoine",96,Anchored customization: anchoring settings to the application interface to afford customization,,,,,,,,,https://open.library.ubc.ca/cIRcle/collections/24/24/items/1.0220520,,2015,2016-09-06 21:02:25,2016-09-06 21:02:25,2016-09-06 21:02:25,,,,,,,Anchored customization,,,,,University of British Columbia,,,,,,,Google Scholar,,,,/home/wagner/.mozilla/firefox/owkxzo1u.default/zotero/storage/RP9CZM5C/1.html,,,,,,,,,,,,,,,,,,,,,,,,,,,,,,,,,,,,,,,,,,,,,,,,,
PZCVPJ9K,journalArticle,2016,"Stark, Jaime L.; Eghbalnia, Hamid R.; Lee, Woonghee; Westler, William M.; Markley, John L.",97,NMRmix: A Tool for the Optimization of Compound Mixtures in 1D 1H NMR Ligand Affinity Screens,,,,Journal of proteome research,,,,,http://pubs.acs.org/doi/abs/10.1021/acs.jproteome.6b00121,,2016,2016-09-06 21:02:25,2016-09-06 21:02:25,2016-09-06 21:02:25,1360–1368,,4,15,,,NMRmix,,,,,,,,,,,,Google Scholar,,,,/home/wagner/.mozilla/firefox/owkxzo1u.default/zotero/storage/9DIFDJAQ/acs.jproteome.html; /home/wagner/.mozilla/firefox/owkxzo1u.default/zotero/storage/F2WEG8E8/acs.jproteome.html,,,,,,,,,,,,,,,,,,,,,,,,,,,,,,,,,,,,,,,,,,,,,,,,,
SZJ27MVA,thesis,2015,"Soong, Theodore",98,Modular Multilevel Converters with Integrated Energy Storage,,,,,,,,,https://tspace.library.utoronto.ca/handle/1807/71617,,2015,2016-09-06 21:02:25,2016-09-06 21:02:25,2016-09-06 21:02:25,,,,,,,,,,,,University of Toronto,,,,,,,Google Scholar,,,,/home/wagner/.mozilla/firefox/owkxzo1u.default/zotero/storage/67HD2FCC/Soong - 2015 - Modular Multilevel Converters with Integrated Ener.pdf; /home/wagner/.mozilla/firefox/owkxzo1u.default/zotero/storage/VZC6TKUX/71617.html,,,,,,,,,,,,,,,,,,,,,,,,,,,,,,,,,,,,,,,,,,,,,,,,,
ISQUQD26,journalArticle,,"Li, Haoxiang; Hua, Gang",99,Egocentric Computer Vision based Wheelchair Robot Control,,,,,,,,,http://personal.stevens.edu/~hli18/data/papers/CamBasedWheelchairRobot.pdf,,,2016-09-06 21:02:25,2016-09-06 21:02:25,2016-09-06 21:02:25,,,,,,,,,,,,,,,,,,,Google Scholar,,,,/home/wagner/.mozilla/firefox/owkxzo1u.default/zotero/storage/UCURFUJJ/Li e Hua - Egocentric Computer Vision based Wheelchair Robot .pdf,,,,,,,,,,,,,,,,,,,,,,,,,,,,,,,,,,,,,,,,,,,,,,,,,
N4HGSGQC,conferencePaper,2015,"Ying, Shenshun; Ji, Shiming; Cai, Donghai; Bao, Guanjun; Fan, Zhun",100,A method to implement biomimetic control for a SMA springs array,,,,2015 IEEE International Conference on Robotics and Biomimetics (ROBIO),,,,,http://ieeexplore.ieee.org/xpls/abs_all.jsp?arnumber=7419701,,2015,2016-09-06 21:02:25,2016-09-06 21:02:25,2016-09-06 21:02:25,2419–2424,,,,,,,,,,,IEEE,,,,,,,Google Scholar,,,,/home/wagner/.mozilla/firefox/owkxzo1u.default/zotero/storage/VI37CSJ4/7419701.html,,,,,,,,,,,,,,,,,,,,,,,,,,,,,,,,,,,,,,,,,,,,,,,,,
76JWRJ9W,conferencePaper,2015,"Guvercin, Selim; Suliyev, Rassim; Tolebi, Gulnur",101,Design of automatic engraving machine controlled via computer,,,,2015 Twelve International Conference on Electronics Computer and Computation (ICECCO),,,,,http://ieeexplore.ieee.org/xpls/abs_all.jsp?arnumber=7416885,,2015,2016-09-06 21:02:25,2016-09-06 21:02:25,2016-09-06 21:02:25,1–3,,,,,,,,,,,IEEE,,,,,,,Google Scholar,,,,/home/wagner/.mozilla/firefox/owkxzo1u.default/zotero/storage/H59WEKKJ/7416885.html,,,,,,,,,,,,,,,,,,,,,,,,,,,,,,,,,,,,,,,,,,,,,,,,,
23DE6B4S,journalArticle,2016,"Vergez, Guillaume; Danaila, Ionut; Auliac, Sylvain; Hecht, Frédéric",102,A finite-element toolbox for the stationary Gross-Pitaevskii equation with rotation,,,,arXiv preprint arXiv:1602.07071,,,,,http://arxiv.org/abs/1602.07071,,2016,2016-09-06 21:03:05,2016-09-06 21:03:05,2016-09-06 21:03:05,,,,,,,,,,,,,,,,,,,Google Scholar,,,,/home/wagner/.mozilla/firefox/owkxzo1u.default/zotero/storage/A3BA9GUJ/Vergez et al. - 2016 - A finite-element toolbox for the stationary Gross-.pdf; /home/wagner/.mozilla/firefox/owkxzo1u.default/zotero/storage/PVEZ7FSX/1602.html,,,,,,,,,,,,,,,,,,,,,,,,,,,,,,,,,,,,,,,,,,,,,,,,,
WMNV5KGX,journalArticle,2016,"Morozov, A.; Solovov, V.; Martins, R.; Neves, F.; Domingos, V.; Chepel, V.",103,ANTS2 package: simulation and experimental data processing for Anger camera type detectors,,,,Journal of Instrumentation,,,,,http://iopscience.iop.org/article/10.1088/1748-0221/11/04/P04022/meta,,2016,2016-09-06 21:03:05,2016-09-06 21:03:05,2016-09-06 21:03:05,P04022,,4,11,,,ANTS2 package,,,,,,,,,,,,Google Scholar,,,,/home/wagner/.mozilla/firefox/owkxzo1u.default/zotero/storage/WXUM7CI4/Morozov et al. - 2016 - ANTS2 package simulation and experimental data pr.pdf; /home/wagner/.mozilla/firefox/owkxzo1u.default/zotero/storage/EG8X9F7E/meta.html,,,,,,,,,,,,,,,,,,,,,,,,,,,,,,,,,,,,,,,,,,,,,,,,,
TRWMN8BN,journalArticle,2016,"Evestedt, Niclas; Ljungqvist, Oskar; Axehill, Daniel",104,Path tracking and stabilization for a reversing general 2-trailer configuration using a cascaded control approach,,,,arXiv preprint arXiv:1602.06675,,,,,http://arxiv.org/abs/1602.06675,,2016,2016-09-06 21:03:05,2016-09-06 21:03:05,2016-09-06 21:03:05,,,,,,,,,,,,,,,,,,,Google Scholar,,,,/home/wagner/.mozilla/firefox/owkxzo1u.default/zotero/storage/U7VTC3EW/Evestedt et al. - 2016 - Path tracking and stabilization for a reversing ge.pdf; /home/wagner/.mozilla/firefox/owkxzo1u.default/zotero/storage/UKDE6HWC/1602.html,,,,,,,,,,,,,,,,,,,,,,,,,,,,,,,,,,,,,,,,,,,,,,,,,
GDWPHKIU,bookSection,2016,"Tiderko, Alexander; Hoeller, Frank; Röhling, Timo",105,The ROS Multimaster Extension for Simplified Deployment of Multi-Robot Systems,,,,Robot Operating System (ROS),,,,,http://link.springer.com/chapter/10.1007/978-3-319-26054-9_24,,2016,2016-09-06 21:03:05,2016-09-06 21:03:05,2016-09-06 21:03:05,629–650,,,,,,,,,,,Springer,,,,,,,Google Scholar,,,,/home/wagner/.mozilla/firefox/owkxzo1u.default/zotero/storage/KGHXFN7G/978-3-319-26054-9_24.html,,,,,,,,,,,,,,,,,,,,,,,,,,,,,,,,,,,,,,,,,,,,,,,,,
TF59RX2A,journalArticle,2016,"Tran, Anh Phuong; Dafflon, Baptiste; Hubbard, Susan",106,iMatTOUGH: An open-source Matlab-based graphical user interface for pre-and post-processing of TOUGH2 and iTOUGH2 models,,,,Computers & Geosciences,,,,,http://www.sciencedirect.com/science/article/pii/S0098300416300310,,2016,2016-09-06 21:03:05,2016-09-06 21:03:05,2016-09-06 21:03:05,132–143,,,89,,,iMatTOUGH,,,,,,,,,,,,Google Scholar,,,,/home/wagner/.mozilla/firefox/owkxzo1u.default/zotero/storage/XFPHG8EF/S0098300416300310.html,,,,,,,,,,,,,,,,,,,,,,,,,,,,,,,,,,,,,,,,,,,,,,,,,
DU84U7BE,journalArticle,2015,"Jeong, Donghwa; Lee, Kiju",107,iSIG-Blocks: interactive creation blocks for tangible geometric games,,,,IEEE Transactions on Consumer Electronics,,,,,http://ieeexplore.ieee.org/xpls/abs_all.jsp?arnumber=7389795,,2015,2016-09-06 21:03:05,2016-09-06 21:03:05,2016-09-06 21:03:05,420–428,,4,61,,,iSIG-Blocks,,,,,,,,,,,,Google Scholar,,,,/home/wagner/.mozilla/firefox/owkxzo1u.default/zotero/storage/PAGESFDZ/7389795.html,,,,,,,,,,,,,,,,,,,,,,,,,,,,,,,,,,,,,,,,,,,,,,,,,
MPZK82M7,journalArticle,2016,"Princz, Daniel",108,The CRANE Framework for Simulation Model Workflows,,,,,,,,,https://uwspace.uwaterloo.ca/handle/10012/10230,,2016,2016-09-06 21:03:05,2016-09-06 21:03:05,2016-09-06 21:03:05,,,,,,,,,,,,,,,,,,,Google Scholar,,,,/home/wagner/.mozilla/firefox/owkxzo1u.default/zotero/storage/QRCF6SN6/Princz - 2016 - The CRANE Framework for Simulation Model Workflows.pdf; /home/wagner/.mozilla/firefox/owkxzo1u.default/zotero/storage/5Q3S2DV2/10230.html,,,,,,,,,,,,,,,,,,,,,,,,,,,,,,,,,,,,,,,,,,,,,,,,,
36FHB3WD,conferencePaper,2015,"Paolanti, Marina; Pollini, Rama; Frontoni, Emanuele; Mancini, Adriano; De Leo, Roberto; Zingaretti, Primo; Bisceglia, Bruno",109,Exposure protocol setup for agro food treatment. Method and system for developing an application for heating in reverberation chamber,,,,"Microwave Symposium (MMS), 2015 IEEE 15th Mediterranean",,,,,http://ieeexplore.ieee.org/xpls/abs_all.jsp?arnumber=7375372,,2015,2016-09-06 21:03:05,2016-09-06 21:03:05,2016-09-06 21:03:05,1–4,,,,,,,,,,,IEEE,,,,,,,Google Scholar,,,,/home/wagner/.mozilla/firefox/owkxzo1u.default/zotero/storage/K69I2MW7/7375372.html,,,,,,,,,,,,,,,,,,,,,,,,,,,,,,,,,,,,,,,,,,,,,,,,,
MEEXB2DV,conferencePaper,2015,"Nesterenko, Brandon; Wang, Wenwen; Yi, Qing",110,Interactive Composition of Compiler Optimizations,,,,International Workshop on Languages and Compilers for Parallel Computing,,,,,http://link.springer.com/chapter/10.1007/978-3-319-29778-1_6,,2015,2016-09-06 21:03:05,2016-09-06 21:03:05,2016-09-06 21:03:05,91–105,,,,,,,,,,,Springer,,,,,,,Google Scholar,,,,/home/wagner/.mozilla/firefox/owkxzo1u.default/zotero/storage/C8EPHRJN/Nesterenko et al. - 2015 - Interactive Composition of Compiler Optimizations.pdf; /home/wagner/.mozilla/firefox/owkxzo1u.default/zotero/storage/VTVMQAXQ/978-3-319-29778-1_6.html,,,,,,,,,,,,,,,,,,,,,,,,,,,,,,,,,,,,,,,,,,,,,,,,,
GHTUD5SP,journalArticle,,"Panchal, Vipul K.; Chavda, Chhaya; Patel, Vijay; Patel, Narendra; Ghosh, Joydeep",111,Software Upgradation of PXI Based Data Acquisition for Aditya Experiments,,,,APFA 2015,,,,,http://www.ipr.res.in/APFA2015/documents/Abstract%20Book%20APFA-2015.pdf#page=151,,,2016-09-06 21:03:05,2016-09-06 21:03:05,2016-09-06 21:03:05,149,,,,,,,,,,,,,,,,,,Google Scholar,,,,/home/wagner/.mozilla/firefox/owkxzo1u.default/zotero/storage/3WTPJQSJ/Abstract Book APFA-2015.pdf,,,,,,,,,,,,,,,,,,,,,,,,,,,,,,,,,,,,,,,,,,,,,,,,,
ZBKT3625,journalArticle,2015,"Meng, Y.; Hadimani, R. L.; Crowther, L. J.; Xu, Z.; Qu, J.; Jiles, D. C.",112,"Modified from a paper published in Journal of Applied Physics, vol. 117, no. 17, p. 17B305, 2015",,,,Cellular level studies and coil system design for transcranial magnetic stimulation,,,,,http://lib.dr.iastate.edu/cgi/viewcontent.cgi?article=5518&context=etd#page=36,,2015,2016-09-06 21:03:05,2016-09-06 21:03:05,2016-09-06 21:03:05,24,,,,,,,,,,,,,,,,,,Google Scholar,,,,/home/wagner/.mozilla/firefox/owkxzo1u.default/zotero/storage/WTZVIHJ8/Meng et al. - 2015 - Modified from a paper published in Journal of Appl.pdf,,,,,,,,,,,,,,,,,,,,,,,,,,,,,,,,,,,,,,,,,,,,,,,,,
6MN6KEKT,bookSection,2016,"Rao, T. Ramamohan; Kirthana, S.",113,Developing a GUI for Optimization of Acoustic Enclosure of a Compressor Chamber,,,,"CAD/CAM, Robotics and Factories of the Future",,,,,http://link.springer.com/chapter/10.1007/978-81-322-2740-3_35,,2016,2016-09-06 21:03:05,2016-09-06 21:03:05,2016-09-06 21:03:05,367–377,,,,,,,,,,,Springer,,,,,,,Google Scholar,,,,/home/wagner/.mozilla/firefox/owkxzo1u.default/zotero/storage/J8PTQMJG/978-81-322-2740-3_35.html,,,,,,,,,,,,,,,,,,,,,,,,,,,,,,,,,,,,,,,,,,,,,,,,,
3B2WSGF4,conferencePaper,2015,"Avcioglu, Alper; Demirer, Mehmet",114,Implementation of system testing automatization on computer aided systems for hardware and software,,,,"IEEE AUTOTESTCON, 2015",,,,,http://ieeexplore.ieee.org/xpls/abs_all.jsp?arnumber=7356478,,2015,2016-09-06 21:03:05,2016-09-06 21:03:05,2016-09-06 21:03:05,127–133,,,,,,,,,,,IEEE,,,,,,,Google Scholar,,,,/home/wagner/.mozilla/firefox/owkxzo1u.default/zotero/storage/3T9D2C3F/7356478.html,,,,,,,,,,,,,,,,,,,,,,,,,,,,,,,,,,,,,,,,,,,,,,,,,
I7CM3UGA,journalArticle,,"Gandotra, Aatish; Singh, Tejaswi",115,SOFTWARE CONTROL SYSTEMS FOR SMART ANTENNA,,,,,,,,,http://esatjournals.net/ijret/2015v04/i11/IJRET20150411028.pdf,,,2016-09-06 21:03:05,2016-09-06 21:03:05,2016-09-06 21:03:05,,,,,,,,,,,,,,,,,,,Google Scholar,,,,/home/wagner/.mozilla/firefox/owkxzo1u.default/zotero/storage/GT9U57ZR/Gandotra e Singh - SOFTWARE CONTROL SYSTEMS FOR SMART ANTENNA.pdf,,,,,,,,,,,,,,,,,,,,,,,,,,,,,,,,,,,,,,,,,,,,,,,,,
6JBTGPKX,journalArticle,2015,"Burnell, Daniel K.; Cooper, Justin; Xu, Jie; Burden, David S.",116,Graphical User Interface for AT123D-AT Solute Transport Model.,,,,Groundwater,,,,,https://www.researchgate.net/profile/Daniel_Burnell/publication/288670443_Graphical_User_Interface_for_AT123D-AT_Solute_Transport_Model/links/5682ef9d08ae051f9aee877b.pdf,,2015,2016-09-06 21:03:05,2016-09-06 21:03:05,2016-09-06 21:03:05,,,,,,,,,,,,,,,,,,,Google Scholar,,,,/home/wagner/.mozilla/firefox/owkxzo1u.default/zotero/storage/3Q28G3W6/Burnell et al. - 2015 - Graphical User Interface for AT123D-AT Solute Tran.pdf,,,,,,,,,,,,,,,,,,,,,,,,,,,,,,,,,,,,,,,,,,,,,,,,,
JUTN7J34,journalArticle,2016,"Mariappan, Muralindran; Ming, Tony Chua Tung; Nadarajan, Manimehala",117,Automated Visual Inspection: Position Identification of Object for Industrial Robot Application based on Color and Shape,,,,International Journal of Intelligent Systems and Applications,,,,,http://search.proquest.com/openview/d9fcd855f2a689b2ab21551d87efea03/1?pq-origsite=gscholar&cbl=2026672,,2016,2016-09-06 21:03:05,2016-09-06 21:03:05,2016-09-06 21:03:05,9,,1,8,,,Automated Visual Inspection,,,,,,,,,,,,Google Scholar,,,,/home/wagner/.mozilla/firefox/owkxzo1u.default/zotero/storage/7DKPP4NF/Mariappan et al. - 2016 - Automated Visual Inspection Position Identificati.pdf; /home/wagner/.mozilla/firefox/owkxzo1u.default/zotero/storage/FA9D49V2/1.html,,,,,,,,,,,,,,,,,,,,,,,,,,,,,,,,,,,,,,,,,,,,,,,,,
A66D32ZF,journalArticle,2015,"Leibrandt, D. R.; Heidecker, J.",118,"An open source digital servo for atomic, molecular, and optical physics experiments",,,,Review of Scientific Instruments,,,,,http://scitation.aip.org/content/aip/journal/rsi/86/12/10.1063/1.4938282,,2015,2016-09-06 21:03:05,2016-09-06 21:03:05,2016-09-06 21:03:05,123115,,12,86,,,,,,,,,,,,,,,Google Scholar,,,,"/home/wagner/.mozilla/firefox/owkxzo1u.default/zotero/storage/UKZ4BDQT/Leibrandt e Heidecker - 2015 - An open source digital servo for atomic, molecular.pdf; /home/wagner/.mozilla/firefox/owkxzo1u.default/zotero/storage/V7NJNFI5/1.html",,,,,,,,,,,,,,,,,,,,,,,,,,,,,,,,,,,,,,,,,,,,,,,,,
QS8GGMJW,journalArticle,2015,"Morgan, Fearghal; Krewer, Finn; Callaly, Frank; Coffey, Aedan; Mc Ginley, Brian",119,Web-enabled Neuron Model Hardware Implementation and Testing,,,,,,,,,https://www.researchgate.net/profile/Brian_Mc_Ginley/publication/284435160_Web-enabled_Neuron_Model_Hardware_Implementation_and_Testing/links/567011d008aecdcd23588d81.pdf,,2015,2016-09-06 21:03:05,2016-09-06 21:03:05,2016-09-06 21:03:05,,,,,,,,,,,,,,,,,,,Google Scholar,,,,/home/wagner/.mozilla/firefox/owkxzo1u.default/zotero/storage/W2PCNUBV/Morgan et al. - 2015 - Web-enabled Neuron Model Hardware Implementation a.pdf,,,,,,,,,,,,,,,,,,,,,,,,,,,,,,,,,,,,,,,,,,,,,,,,,
ZUXQ4PS7,journalArticle,2016,"Tennina, Stefano; Gaddour, Olfa; Koubâa, Anis; Royo, Fernando; Alves, Mário; Abid, Mohamed",120,Z-Monitor: A protocol analyzer for IEEE 802.15. 4-based low-power wireless networks,,,,Computer Networks,,,,,http://www.sciencedirect.com/science/article/pii/S1389128615004788,,2016,2016-09-06 21:03:05,2016-09-06 21:03:05,2016-09-06 21:03:05,77–96,,,95,,,Z-Monitor,,,,,,,,,,,,Google Scholar,,,,/home/wagner/.mozilla/firefox/owkxzo1u.default/zotero/storage/7C6FB8CX/S1389128615004788.html,,,,,,,,,,,,,,,,,,,,,,,,,,,,,,,,,,,,,,,,,,,,,,,,,
UG2XA4N3,conferencePaper,2015,"Paisana, Francisco; Santos, Joao F.; Kaminski, Nicholas J.; Marquez-Barja, Johann M.; Marchetti, Nicola; DaSilva, Luiz A.",121,Implementation of temporal spectrum sharing for radar bands,,,,"Dynamic Spectrum Access Networks (DySPAN), 2015 IEEE International Symposium on",,,,,http://ieeexplore.ieee.org/xpls/abs_all.jsp?arnumber=7343913,,2015,2016-09-06 21:03:05,2016-09-06 21:03:05,2016-09-06 21:03:05,271–272,,,,,,,,,,,IEEE,,,,,,,Google Scholar,,,,/home/wagner/.mozilla/firefox/owkxzo1u.default/zotero/storage/Q264FUA8/7343913.html,,,,,,,,,,,,,,,,,,,,,,,,,,,,,,,,,,,,,,,,,,,,,,,,,
DSPVFPBI,conferencePaper,2015,"Corzilius, Florian; Kremer, Gereon; Junges, Sebastian; Schupp, Stefan; Ábrahám, Erika",122,SMT-RAT: An Open Source C++ Toolbox for Strategic and Parallel SMT Solving,,,,International Conference on Theory and Applications of Satisfiability Testing,,,,,http://link.springer.com/chapter/10.1007/978-3-319-24318-4_26,,2015,2016-09-06 21:03:34,2016-09-06 21:03:34,2016-09-06 21:03:34,360–368,,,,,,SMT-RAT,,,,,Springer,,,,,,,Google Scholar,,,,/home/wagner/.mozilla/firefox/owkxzo1u.default/zotero/storage/ZF6CQWMT/978-3-319-24318-4_26.html,,,,,,,,,,,,,,,,,,,,,,,,,,,,,,,,,,,,,,,,,,,,,,,,,
ZVBUK8UR,report,2015,"Karsai, Gabor; Dubey, Abhishek; Mahadevan, Nag",123,Resilient Software Systems,,,,,,,,,http://oai.dtic.mil/oai/oai?verb=getRecord&metadataPrefix=html&identifier=ADA619849,,2015,2016-09-06 21:03:34,2016-09-06 21:03:34,2016-09-06 21:03:34,,,,,,,,,,,,DTIC Document,,,,,,,Google Scholar,,,,/home/wagner/.mozilla/firefox/owkxzo1u.default/zotero/storage/T6KBBIVH/Karsai et al. - 2015 - Resilient Software Systems.pdf; /home/wagner/.mozilla/firefox/owkxzo1u.default/zotero/storage/C2JHP8N5/oai.html,,,,,,,,,,,,,,,,,,,,,,,,,,,,,,,,,,,,,,,,,,,,,,,,,
UZ7GRZ8C,journalArticle,2015,"Ocepek, Benjamin",124,A Generic Timing Receiver for Event-Driven Timing Systems/Genericni sprejemnik dogodkovno gnanega sistema za sinhronizacijo takta ure,,,,Elektrotehniski Vestnik,,,,,http://search.proquest.com/openview/efbdae61a3ad6657eebdff14cc576a82/1?pq-origsite=gscholar,,2015,2016-09-06 21:03:34,2016-09-06 21:03:34,2016-09-06 21:03:34,205,,4,82,,,,,,,,,,,,,,,Google Scholar,,,,/home/wagner/.mozilla/firefox/owkxzo1u.default/zotero/storage/WVEHJAWK/Ocepek - 2015 - A Generic Timing Receiver for Event-Driven Timing .pdf; /home/wagner/.mozilla/firefox/owkxzo1u.default/zotero/storage/EEEREQ3Q/1.html,,,,,,,,,,,,,,,,,,,,,,,,,,,,,,,,,,,,,,,,,,,,,,,,,
NPI29CFI,journalArticle,2016,"Vergara-Perez, Sandra; Marucho, Marcelo",125,"MPBEC, a Matlab Program for Biomolecular Electrostatic Calculations",,,,Computer physics communications,,,,,http://www.sciencedirect.com/science/article/pii/S0010465515003288,,2016,2016-09-06 21:03:34,2016-09-06 21:03:34,2016-09-06 21:03:34,179–194,,,198,,,,,,,,,,,,,,,Google Scholar,,,,/home/wagner/.mozilla/firefox/owkxzo1u.default/zotero/storage/M6SU8VZX/PMC4767531.html; /home/wagner/.mozilla/firefox/owkxzo1u.default/zotero/storage/UMCSN5HJ/S0010465515003288.html,,,,,,,,,,,,,,,,,,,,,,,,,,,,,,,,,,,,,,,,,,,,,,,,,
JR4QII3Q,book,2015,"Petrasova, Anna; Harmon, Brendan; Petras, Vaclav; Mitasova, Helena",126,Tangible Modeling with Open Source GIS,,,,,,,,,http://link.springer.com/content/pdf/10.1007/978-3-319-25775-4.pdf,,2015,2016-09-06 21:03:51,2016-09-06 21:03:51,2016-09-06 21:03:51,,,,,,,,,,,,Springer,,,,,,,Google Scholar,,,,/home/wagner/.mozilla/firefox/owkxzo1u.default/zotero/storage/86SH2QG2/978-3-319-25775-4.html,,,,,,,,,,,,,,,,,,,,,,,,,,,,,,,,,,,,,,,,,,,,,,,,,
RH9D2VJ8,conferencePaper,2015,"López-Erauskin, Ramón; Geury, Thomas; González, Ander; Gyselinck, Johan; Hervás, María Emilia; Fabre, Alexis; Betancourt, Uta; Ackermann, Thomas",127,Testing the Enhanced Functionalities of Commercial PV Inverters Under Realistic Atmospheric and Abnormal Grid Conditions,,,,"Proceedings of the 5th Solar Integration Workshop, International Workshop on Integration of Solar Power into Power System",,,,,https://www.researchgate.net/profile/Ander_Gonzalez/publication/285523327_Testing_the_Enhanced_Functionalities_of_Commercial_PV_Inverters_Under_Realistic_Atmospheric_and_Abnormal_Grid_Conditions/links/566adfc008ae1a797e395d3d.pdf,,2015,2016-09-06 21:03:51,2016-09-06 21:03:51,2016-09-06 21:03:51,,,,,,,,,,,,Energynautics GmbH,,,,,,,Google Scholar,,,,/home/wagner/.mozilla/firefox/owkxzo1u.default/zotero/storage/8RJ4DXER/López-Erauskin et al. - 2015 - Testing the Enhanced Functionalities of Commercial.pdf,,,,,,,,,,,,,,,,,,,,,,,,,,,,,,,,,,,,,,,,,,,,,,,,,
