Key,Item Type,Publication Year,Author,1,Title,Fonte,TipoDoLink,TrataSobreGUI,Publication Title,AssuntoGUI,ISBN,ISSN,DOI,Url,Abstract Note,Date,Date Added,Date Modified,Access Date,Pages,Num Pages,Issue,Volume,Number Of Volumes,Journal Abbreviation,Short Title,Series,Series Number,Series Text,Series Title,Publisher,Place,Language,Rights,Type,Archive,Archive Location,Library Catalog,Call Number,Extra,Notes,File Attachments,Link Attachments,Manual Tags,Automatic Tags,Editor,Series Editor,Translator,Contributor,Attorney Agent,Book Author,Cast Member,Commenter,Composer,Cosponsor,Counsel,Interviewer,Producer,Recipient,Reviewed Author,Scriptwriter,Words By,Guest,Number,Edition,Running Time,Scale,Medium,Artwork Size,Filing Date,Application Number,Assignee,Issuing Authority,Country,Meeting Name,Conference Name,Court,References,Reporter,Legal Status,Priority Numbers,Programming Language,Version,System,Code,Code Number,Section,Session,Committee,History,Legislative Body
9RWQM5GP,journalArticle,2015,"Soni, Neha",128,An Empirical Performance Analysis Of IaaS Clouds With CloudStone Web 2.0 Benchmarking Tool,,,,,,,,,http://digitalcommons.unf.edu/etd/583/,,2015,2016-09-06 21:03:51,2016-09-06 21:03:51,2016-09-06 21:03:51,,,,,,,,,,,,,,,,,,,Google Scholar,,,,/home/wagner/.mozilla/firefox/owkxzo1u.default/zotero/storage/XHFDEVRJ/Soni - 2015 - An Empirical Performance Analysis Of IaaS Clouds W.pdf; /home/wagner/.mozilla/firefox/owkxzo1u.default/zotero/storage/PD95QRNB/583.html,,,,,,,,,,,,,,,,,,,,,,,,,,,,,,,,,,,,,,,,,,,,,,,,,
XDDRAPRQ,conferencePaper,2015,"Pulok, Md Kamrul Hasan; Faruque, M. Omar",129,Real-time dynamic state estimation using synchrophasor data,,,,"North American Power Symposium (NAPS), 2015",,,,,http://ieeexplore.ieee.org/xpls/abs_all.jsp?arnumber=7335169,,2015,2016-09-06 21:03:51,2016-09-06 21:03:51,2016-09-06 21:03:51,1–6,,,,,,,,,,,IEEE,,,,,,,Google Scholar,,,,/home/wagner/.mozilla/firefox/owkxzo1u.default/zotero/storage/VAC4N47X/7335169.html,,,,,,,,,,,,,,,,,,,,,,,,,,,,,,,,,,,,,,,,,,,,,,,,,
S4ICUF43,journalArticle,2015,"Paulov, Ivan",130,Routing in a Virtualised Environment with RouterOS,,,,,,,,,http://www.theseus.fi/handle/10024/101581,,2015,2016-09-06 21:03:51,2016-09-06 21:03:51,2016-09-06 21:03:51,,,,,,,,,,,,,,,,,,,Google Scholar,,,,/home/wagner/.mozilla/firefox/owkxzo1u.default/zotero/storage/HRUQWVVM/Paulov - 2015 - Routing in a Virtualised Environment with RouterOS.pdf; /home/wagner/.mozilla/firefox/owkxzo1u.default/zotero/storage/JCMB6KJC/101581.html,,,,,,,,,,,,,,,,,,,,,,,,,,,,,,,,,,,,,,,,,,,,,,,,,
S3DQBTN8,conferencePaper,2015,"Kemal, Mohammed; Iov, Florin; Olsen, Rasmus; Le Fevre, Thomas; Apostolopoulos, Christos",131,On-line configuration of network emulator for intelligent energy system testbed applications,,,,"AFRICON, 2015",,,,,http://ieeexplore.ieee.org/xpls/abs_all.jsp?arnumber=7331979,,2015,2016-09-06 21:03:51,2016-09-06 21:03:51,2016-09-06 21:03:51,1–4,,,,,,,,,,,IEEE,,,,,,,Google Scholar,,,,/home/wagner/.mozilla/firefox/owkxzo1u.default/zotero/storage/AHPMM7NW/7331979.html,,,,,,,,,,,,,,,,,,,,,,,,,,,,,,,,,,,,,,,,,,,,,,,,,
JJSAB4RQ,journalArticle,,"Mohamed, Izzeldin Ibrahim",132,Development of a Low Cost and High Performance System on Chip Embedded Logic Analyzer,,,,,,,,,http://ijesc.org/upload/b438707ed71ba17f65b52124817ede2f.Development%20of%20a%20Low%20Cost%20and%20High%20Performance%20System%20on%20Chip%20Embedded%20Logic%20Analyzer.pdf,,,2016-09-06 21:03:51,2016-09-06 21:03:51,2016-09-06 21:03:51,,,,,,,,,,,,,,,,,,,Google Scholar,,,,/home/wagner/.mozilla/firefox/owkxzo1u.default/zotero/storage/4H7P8H4F/Mohamed - Development of a Low Cost and High Performance Sys.pdf,,,,,,,,,,,,,,,,,,,,,,,,,,,,,,,,,,,,,,,,,,,,,,,,,
JAZ4DJSS,thesis,2015,"Yang, Zhiyao",133,Development of simulation modules for liquid desiccant systems in SorpSim,,,,,,,,,http://gradworks.umi.com/15/98/1598336.html,,2015,2016-09-06 21:03:51,2016-09-06 21:03:51,2016-09-06 21:03:51,,,,,,,,,,,,PURDUE UNIVERSITY,,,,,,,Google Scholar,,,,/home/wagner/.mozilla/firefox/owkxzo1u.default/zotero/storage/S3AW4I29/1598336.html,,,,,,,,,,,,,,,,,,,,,,,,,,,,,,,,,,,,,,,,,,,,,,,,,
BRKT7ID5,conferencePaper,2015,"Wichrowski, Marcin; Koržinek, Danijel; Szklanny, Krzysztof",134,Google Glass Development in Practice: UX Design Sprint Workshops,,,,"Proceedings of the Mulitimedia, Interaction, Design and Innnovation",,,,,http://dl.acm.org/citation.cfm?id=2814475,,2015,2016-09-06 21:03:51,2016-09-06 21:03:51,2016-09-06 21:03:51,11,,,,,,Google Glass Development in Practice,,,,,ACM,,,,,,,Google Scholar,,,,/home/wagner/.mozilla/firefox/owkxzo1u.default/zotero/storage/G2TM9US4/citation.html,,,,,,,,,,,,,,,,,,,,,,,,,,,,,,,,,,,,,,,,,,,,,,,,,
F3NDWFGP,journalArticle,2015,"OLEYNIK, PP",135,Unified metamodel of object system,,,,Объектные системы,,,,,http://cyberleninka.ru/article/n/unified-metamodel-of-object-system,,2015,2016-09-06 21:03:51,2016-09-06 21:03:51,2016-09-06 21:03:51,,,10 (10),,,,,,,,,,,,,,,,Google Scholar,,,,/home/wagner/.mozilla/firefox/owkxzo1u.default/zotero/storage/44ME5KKW/unified-metamodel-of-object-system.html,,,,,,,,,,,,,,,,,,,,,,,,,,,,,,,,,,,,,,,,,,,,,,,,,
ZMFHJ5H5,journalArticle,2015,"Wacha, Andrįs",136,Optimized pinhole geometry for small-angle scattering,,,,Journal of Applied Crystallography,,,,,http://scripts.iucr.org/cgi-bin/paper?s1600576715018932,,2015,2016-09-06 21:03:51,2016-09-06 21:03:51,2016-09-06 21:03:51,,,6,48,,,,,,,,,,,,,,,Google Scholar,,,,/home/wagner/.mozilla/firefox/owkxzo1u.default/zotero/storage/KHZI7AIP/paper.html,,,,,,,,,,,,,,,,,,,,,,,,,,,,,,,,,,,,,,,,,,,,,,,,,
T32JR4P4,journalArticle,2015,"Apajalahti, Kasper; others",137,Semantic Search Interface for an Intelligent Network Management System–A Case Study,,,,,,,,,https://aaltodoc.aalto.fi/handle/123456789/18660,,2015,2016-09-06 21:03:51,2016-09-06 21:03:51,2016-09-06 21:03:51,,,,,,,,,,,,,,,,,,,Google Scholar,,,,/home/wagner/.mozilla/firefox/owkxzo1u.default/zotero/storage/JDUNV4ZH/Apajalahti e others - 2015 - Semantic Search Interface for an Intelligent Netwo.pdf; /home/wagner/.mozilla/firefox/owkxzo1u.default/zotero/storage/ZMW5D69D/18660.html,,,,,,,,,,,,,,,,,,,,,,,,,,,,,,,,,,,,,,,,,,,,,,,,,
A28MG9EP,journalArticle,,"Ee, Chung Sheng; Ting, Fung Fung; Sim, Kok Swee; Tso, Chih Ping",138,Development of a Graphical User Interface Training System for Early Infarct Detection,,,,imaging,,,,,http://www.ijiee.org/vol6/594-Y025.pdf,,,2016-09-06 21:03:51,2016-09-06 21:03:51,2016-09-06 21:03:51,7,,,6,,,,,,,,,,,,,,,Google Scholar,,,,/home/wagner/.mozilla/firefox/owkxzo1u.default/zotero/storage/ISHASA2T/Ee et al. - Development of a Graphical User Interface Training.pdf,,,,,,,,,,,,,,,,,,,,,,,,,,,,,,,,,,,,,,,,,,,,,,,,,
RCQZFG4M,book,2015,"Jadhav, Sangram R.; Parihar, Mahesh N.; Jadhav, Sharad P.",139,LabVIEW based Design and Implementation of Analog PI Controller for Dynamic Level of a Tank,,,,,,,,,http://discoveryjournals.com/discovery/current_issue/v45/n210/A2.pdf,,2015,2016-09-06 21:03:51,2016-09-06 21:03:51,2016-09-06 21:03:51,,162–168,,45,,,,,210,,,Discovery,,,,,,,Google Scholar,,,,/home/wagner/.mozilla/firefox/owkxzo1u.default/zotero/storage/XMZ7SC5S/Jadhav et al. - 2015 - LabVIEW based Design and Implementation of Analog .pdf,,,,,,,,,,,,,,,,,,,,,,,,,,,,,,,,,,,,,,,,,,,,,,,,,
ZVAPGJI2,bookSection,2015,"Carter, Peter A.",140,Server Core Installation,,,,Pro SQL Server Administration,,,,,http://link.springer.com/chapter/10.1007/978-1-4842-0710-9_3,,2015,2016-09-06 21:03:51,2016-09-06 21:03:51,2016-09-06 21:03:51,65–88,,,,,,,,,,,Springer,,,,,,,Google Scholar,,,,/home/wagner/.mozilla/firefox/owkxzo1u.default/zotero/storage/VXZCC2XK/978-1-4842-0710-9_3.html,,,,,,,,,,,,,,,,,,,,,,,,,,,,,,,,,,,,,,,,,,,,,,,,,
GNH54KPK,conferencePaper,2015,"Kuznetsova, Alexandra; Brockhoff, Per B.; Amorim, Isabel de Sousa; Mielby, L.; Bech, Søren; Ribeiro de Lima, R.",141,SensMixed R package: Easy-to-use application with graphical user interface for analyzing sensory and consumer data within a mixed effects model framework,,,,11th Pangborn Sensory Science Symposium,,,,,http://orbit.dtu.dk/ws/files/117915914/SensMixed_R_package.pdf,,2015,2016-09-06 21:03:51,2016-09-06 21:03:51,2016-09-06 21:03:51,,,,,,,SensMixed R package,,,,,,,,,,,,Google Scholar,,,,/home/wagner/.mozilla/firefox/owkxzo1u.default/zotero/storage/KQWZEK5H/SensMixed_R_package.pdf,,,,,,,,,,,,,,,,,,,,,,,,,,,,,,,,,,,,,,,,,,,,,,,,,
VCZ7UCJT,conferencePaper,2015,"Bien, Ngo Huy; Thu, Tran Dan",142,Graphical User Interface Variability Architecture Pattern,,,,Proceedings of the Sixth International Symposium on Information and Communication Technology,,,,,http://dl.acm.org/citation.cfm?id=2833284,,2015,2016-09-06 21:03:51,2016-09-06 21:03:51,2016-09-06 21:03:51,304–311,,,,,,,,,,,ACM,,,,,,,Google Scholar,,,,/home/wagner/.mozilla/firefox/owkxzo1u.default/zotero/storage/ED5QXDSZ/citation.html,,,,,,,,,,,,,,,,,,,,,,,,,,,,,,,,,,,,,,,,,,,,,,,,,
IJFMGGD3,journalArticle,2015,"Nguyen, Thanh; Nehmetallah, George; Tran, Dat; Darudi, Ahmad; Soltani, Peyman",143,"Fully automated, high speed, tomographic phase object reconstruction using the transport of intensity equation in transmission and reflection configurations",,,,Applied optics,,,,,https://www.osapublishing.org/abstract.cfm?uri=ao-54-35-10443,,2015,2016-09-06 21:03:51,2016-09-06 21:03:51,2016-09-06 21:03:51,10443–10453,,35,54,,,,,,,,,,,,,,,Google Scholar,,,,"/home/wagner/.mozilla/firefox/owkxzo1u.default/zotero/storage/4IVPAB6X/Nguyen et al. - 2015 - Fully automated, high speed, tomographic phase obj.pdf; /home/wagner/.mozilla/firefox/owkxzo1u.default/zotero/storage/CFPE94KT/abstract.html",,,,,,,,,,,,,,,,,,,,,,,,,,,,,,,,,,,,,,,,,,,,,,,,,
FTWUBMZ5,conferencePaper,2015,"Chang, Chung-Liang; Song, Gong-Bo; Huang, Ying-Ming; Miao, Jr-Ming",144,Microclimate Sensing and Environmental Regulation System based on Cloud-computing for Greenhouse,,,,2015 ASABE Annual International Meeting,,,,,http://elibrary.asabe.org/abstract.asp?aid=46317,,2015,2016-09-06 21:03:51,2016-09-06 21:03:51,2016-09-06 21:03:51,1,,,,,,,,,,,American Society of Agricultural and Biological Engineers,,,,,,,Google Scholar,,,,/home/wagner/.mozilla/firefox/owkxzo1u.default/zotero/storage/DF24IADV/abstract.html,,,,,,,,,,,,,,,,,,,,,,,,,,,,,,,,,,,,,,,,,,,,,,,,,
XR47U3EB,thesis,2015,"Smith, C. L.",145,Usability engineering in the design and evaluation of a functional electrical stimulation system for upper limb rehabilitation,,,,,,,,,http://usir.salford.ac.uk/id/eprint/36172,,2015,2016-09-06 21:03:51,2016-09-06 21:03:51,2016-09-06 21:03:51,,,,,,,,,,,,University of Salford,,,,,,,Google Scholar,,,,/home/wagner/.mozilla/firefox/owkxzo1u.default/zotero/storage/UH7VKS5A/36172.html,,,,,,,,,,,,,,,,,,,,,,,,,,,,,,,,,,,,,,,,,,,,,,,,,
